{
  "report_version": "1.0",
  "agent_role": "FIRST_PRINCIPLES_PHYSICS_AUDITOR",
  "repo_snapshot": {
    "files_scanned": [
      "README.md",
      "pyproject.toml",
      "Makefile",
      "ROADMAP.md",
      "VERDICT.md",
      "CHANGELOG.md",
      "CITATION.cff",
      ".github/workflows/ci.yml",
      "noesis/cli.py",
      "noesis/pipeline_v8.py",
      "noesis/gate_functional.py",
      "noesis/precision_gate.py",
      "noesis/forbidden.py",
      "noesis/provenance.py",
      "noesis/validators.py",
      "noesis/evidence.py",
      "noesis/verdict.py",
      "noesis/bibliography.py",
      "noesis/intent_vector.py",
      "noesis/eiic.py",
      "noesis/collapse_controller.py",
      "noesis/entropy_ledger.py",
      "data/bibliography.bib",
      "schemas/",
      "tests/",
      "docs/",
      "examples/",
      "prompts/",
      "app/api.py"
    ],
    "missing_expected_files": [
      "src/** (project uses top-level packages noesis/, tools/, app/, formal/ instead)",
      "benchmarks/** (benchmark code lives in noesis/benchmark*.py)",
      "data/physics_boundary_report.json (created by this audit)",
      "schemas/physics_boundary_report.schema.json (created by this audit)"
    ],
    "detected_entrypoints": [
      "noesis.cli:main (console_script `noesis`, 44 subcommands incl. `bibliography`)",
      "app.api:app (FastAPI, `uvicorn app.api:app`, incl. /bibliography/* endpoints)",
      "tools.finalizer100:main (console_script `finalizer100`)",
      "tools.pipeline:main (console_script `cmm-pipeline`)"
    ],
    "detected_tests": [
      "tests/test_noesis.py",
      "tests/test_noesis_v3.py",
      "tests/test_noesis_v4.py",
      "tests/test_noesis_v5.py",
      "tests/test_noesis_v6.py",
      "tests/test_noesis_v7.py",
      "tests/test_noesis_v8.py",
      "tests/test_noesis_examples.py",
      "tests/test_bibliography_coverage.py",
      "tests/test_gate_math.py",
      "tests/test_cli.py",
      "tests/test_reflection_schema.py",
      "tests/test_reverse_inference.py",
      "tests/test_formal.py",
      "tests/test_pipeline.py",
      "tests/test_finalizer.py",
      "tests/test_api.py",
      "tests/test_physics_boundary_report_schema.py"
    ],
    "detected_schemas": [
      "schemas/intent.schema.json",
      "schemas/intent_vector.schema.json",
      "schemas/reflection.schema.json",
      "schemas/artifact.schema.json",
      "schemas/validation.schema.json",
      "schemas/inference_trace.schema.json",
      "schemas/evidence_bundle_v8.schema.json",
      "schemas/precision_gate.schema.json",
      "schemas/collapse_decision.schema.json",
      "schemas/entropy_ledger.schema.json",
      "schemas/eiic.schema.json",
      "schemas/physics_boundary_report.schema.json",
      "... 38 schema files total under schemas/"
    ],
    "detected_docs": [
      "docs/ARCHITECTURE.md",
      "docs/CLAIM_GOVERNANCE.md",
      "docs/BIBLIOGRAPHIC_EVIDENCE_GRAPH.md",
      "docs/BIBLIOGRAPHY.md",
      "docs/METHODOLOGY.md",
      "docs/THEORIES.md",
      "docs/VALIDATION_V8.md",
      "docs/IEV_PRECISION_GATE.md",
      "docs/NAME.md",
      "... ~47 markdown docs under docs/"
    ]
  },
  "system_identity": {
    "system_type": "Deterministic + LLM-assisted externalized-metacognition pipeline (a controlled state-transformation loop over text), shipped as the `noesis` CLI (44 subcommands) and a FastAPI service. NOT AGI, therapy, diagnosis, or consciousness detection.",
    "core_transformation": "raw_text -> complexity -> adaptive mirror -> causal categories -> reality-map delta -> theory contribution -> EIIC -> action selection -> artifact -> 12 gates -> Evidence Bundle -> verdict; with a claim-to-source bibliographic evidence graph as a cross-cutting governance layer",
    "input_state": "raw user text (intent-bearing natural language), file under examples/ or CLI arg",
    "output_state": "Evidence Bundle (15 files in v0.8: manifest.json + per-stage JSON artifacts + validation.json + verdict.md) with overall_status PASS/FAIL, sha256 input_hash, deterministic/llm module split",
    "validation_boundary": "12 deterministic gates + jsonschema validation + forbidden-claim detector + hallucination-risk heuristic + provenance tagging + bibliographic evidence-graph gate; LLM output is advisory prose only and cannot pass a gate by itself"
  },
  "state_model": {
    "state_variables": [
      {
        "name": "intent_state",
        "definition": "compressed intent vector extracted from raw text",
        "repo_evidence": ["noesis/intent_vector.py", "schemas/intent_vector.schema.json", "schemas/intent.schema.json", "tests/test_noesis_v7.py"],
        "status": "S1_TESTED"
      },
      {
        "name": "context_state",
        "definition": "complexity profile + active causal categories + reality maps that condition downstream operators",
        "repo_evidence": ["noesis/complexity.py", "noesis/causal.py", "schemas/complexity_profile.schema.json", "schemas/reality_map.schema.json"],
        "status": "S1_TESTED"
      },
      {
        "name": "candidate_state",
        "definition": "candidate actions / synthesis axes / node plans produced before gating",
        "repo_evidence": ["noesis/synthesis.py", "noesis/node_plan.py", "schemas/action_decision.schema.json", "schemas/synthesis_axis.schema.json"],
        "status": "S1_TESTED"
      },
      {
        "name": "claim_state",
        "definition": "each high-level claim carries exactly one provenance tag (observed/inferred/speculative/forbidden) and, where applicable, a source edge in the bibliographic evidence graph",
        "repo_evidence": ["noesis/provenance.py", "noesis/forbidden.py", "noesis/bibliography.py", "docs/CLAIM_GOVERNANCE.md", "tests/test_noesis_v4.py", "tests/test_bibliography_coverage.py"],
        "status": "S1_TESTED"
      },
      {
        "name": "evidence_state",
        "definition": "persisted Evidence Bundle for a run (raw_input, per-stage artifacts, validation, verdict, manifest with input_hash)",
        "repo_evidence": ["noesis/evidence.py", "noesis/pipeline_v8.py", "schemas/evidence_bundle_v8.schema.json"],
        "status": "S1_TESTED"
      },
      {
        "name": "gate_state",
        "definition": "pass/fail of each of the 12 gates incl. canonical IEV functional w = aR + bV + gP - dK >= theta",
        "repo_evidence": ["noesis/gate_functional.py", "noesis/precision_gate.py", "schemas/precision_gate.schema.json", "tests/test_gate_math.py"],
        "status": "S1_TESTED"
      },
      {
        "name": "artifact_state",
        "definition": "stabilized 7- or 10-section artifact written to the bundle",
        "repo_evidence": ["noesis/synthesis.py", "tools/artifact_checker.py", "schemas/artifact.schema.json", "tests/test_finalizer.py"],
        "status": "S1_TESTED"
      },
      {
        "name": "verification_state",
        "definition": "ValidationReport per artifact type (fields, word-count, anchors, forbidden, hallucination, falsifier present)",
        "repo_evidence": ["noesis/validators.py", "schemas/validation.schema.json", "noesis/verdict.py"],
        "status": "S1_TESTED"
      },
      {
        "name": "release_state",
        "definition": "overall_status PASS/FAIL emitted by `noesis verdict <bundle>`, gating release of the run",
        "repo_evidence": ["noesis/verdict.py", "noesis/cli.py:_cmd_verdict", "VERDICT.md"],
        "status": "S1_TESTED"
      },
      {
        "name": "trajectory_state",
        "definition": "an explicit per-operator stepwise trace (state_t, operation_t, score_t, decision_t, rollback_condition_t, state_t+1) for one run",
        "repo_evidence": ["noesis/trajectory.py", "schemas/trajectory_trace.schema.json", "tests/test_trajectory_trace.py", "noesis/pipeline_v8.py (emits out/trajectory_trace.json)"],
        "status": "S1_TESTED"
      }
    ]
  },
  "constraints": {
    "boundary_conditions": [
      "every emitted artifact MUST validate against its jsonschema (jsonschema dependency, tests/test_reflection_schema.py)",
      "every high-level claim MUST carry exactly one provenance tag {observed, inferred, speculative, forbidden} (noesis/provenance.py)",
      "every literature-grounded claim MUST resolve to a source in the bibliographic evidence graph (noesis/bibliography.py, Gate coverage in tests/test_bibliography_coverage.py)",
      "an artifact MUST pass all 12 gates for overall_status PASS (noesis/pipeline_v8.py)",
      "extrapolated EIIC cores are force-tagged speculative (Gate 8) and cannot be reported as observed",
      "ruff + mypy --strict + pytest with a >=90% coverage gate MUST be green in CI (.github/workflows/ci.yml)"
    ],
    "forbidden_claims": [
      "AGI / artificial general intelligence achieved",
      "consciousness detected / measured / system is conscious",
      "IIT proves experience",
      "medical diagnosis / healing / therapy / replaces clinician",
      "destiny / karma / mysticism / esoteric",
      "validated brain model / validated neuroscience without data",
      "overconfidence markers (guaranteed, 100% accurate, never errs)"
    ],
    "non_scope": [
      "live clinical or diagnostic use",
      "autonomous action without human responsibility",
      "claims of subjective quality improvement without human evaluation (deferred to Phase 3 in VERDICT.md)",
      "treating proxy benchmark rates as proof of usefulness"
    ]
  },
  "invariants": [
    {
      "name": "intent_coherence",
      "must_conserve": "downstream artifact stays aligned with the extracted intent vector",
      "how_verified": "intent_coherence_score in manifest (noesis/pipeline_v8.py) + signal/noise separation check in validators",
      "failure_if_broken": "mirror restates surface intent instead of hidden goal; gate fails, overall_status FAIL"
    },
    {
      "name": "claim_status_traceability",
      "must_conserve": "every high-level claim has exactly one provenance tag",